{
  "approval_state": "CANDIDATE",
  "classification": "INTERNAL",
  "confidence": 1.0,
  "content": {
    "fact": "synthetic"
  },
  "created_at": "2026-08-21T12:00:00Z",
  "expires_at": "2026-09-20T12:00:00Z",
  "memory_id": "00000000-0000-4000-8000-000000000010",
  "memory_scope": "PROJECT",
  "provenance_ids": [
    "00000000-0000-4000-8000-000000000006"
  ],
  "schema_version": "1.0.0",
  "scope": {
    "permission_version": "perm-1",
    "project_id": "00000000-0000-4000-8000-000000000002",
    "role_codes": [
      "NDT_ENGINEER"
    ],
    "schema_version": "1.0.0",
    "tenant_id": "00000000-0000-4000-8000-000000000001",
    "user_id": "00000000-0000-4000-8000-000000000003"
  }
}
